{
  "type": "claims",
  "version": 1,
  "doc_path": "some/document.md",
  "claims": [
    {
      "id": "claim-1",
      "text": "The sky is blue.",
      "heading": "Introduction",
      "span": {
        "start": 0,
        "end": 15
      },
      "claim_type": "factual"
    },
    {
      "id": "claim-2",
      "text": "Water is wet.",
      "heading": "Introduction",
      "span": {
        "start": 16,
        "end": 29
      },
      "claim_type": "factual"
    }
  ]
}